site,avatar-icon,avatar-bg,avatar-color,ttl,url,desc
bousai,mdi-castle,grey,white,災害資料: 内閣府,https://www.bousai.go.jp/updates/r60101notojishin/index.html,被害状況等についての速報と会議資料・議事録
kantei,mdi-castle,grey,white,記者会見: 首相官邸,https://www.kantei.go.jp/jp/tyoukanpress/index.html,官房長官の定例記者会見（原則月曜日から金曜日、午前と午後の二回）の様子など
gov-online,mdi-home-flood,blue,white,避難情報: 政府広報,https://www.gov-online.go.jp/,政府の広報・広聴活動をまとめたポータルサイト。内閣府大臣官房政府広報室が運営
mof,mdi-bank,grey,white,お金のこと: 財務省,https://www.mof.go.jp/public_relations/disaster/202401_notohantou-jishin/20240102104555.html,税金関係 地震保険関係 財務局関係 政策金融関係
jma,mdi-tsunami,blue,white,地震と天気: 気象庁,https://www.jma.go.jp/jma/press/index.html?t=1&y=06,地震についての速報とその他災害情報
jma-kanazawa,mdi-tsunami,blue,white,地震ポータル: 金沢地方気象台,https://www.data.jma.go.jp/kanazawa/shosai/notojishinportal.html,最大震度5強以上を観測した地震の発生状況、地震や気象関連の情報の取りまとめ、関連報道発表資料
jishin,mdi-terrain,blue,black,地震の研究: 地震本部,https://www.jishin.go.jp/,平成7年1月17日に発生した阪神・淡路大震災の経験を活かし、地震に関する調査研究の成果を社会に伝え、政府として一元的に推進するために設置された特別の機関
shien,mdi-hand-coin,orange,yellow,募金・ボランティア,,現在のところ、災害ボランティアの募集、個人からの義援物資の受付は行っておりません。石川県では、日本赤十字社石川県支部及び石川県共同募金会と連携し、令和6年1月4日（木曜日）から令和6年12月27日（金曜日）の間、義援金を受け付けます。