site,avatar-icon,avatar-bg,avatar-color,date,time,update-date,update-time,ttl,url,desc
shien,mdi-pause-octagon,white,red,,,2024-01-01,,令和6年能登半島地震に係るボランティア情報 | 石川県,https://www.pref.ishikawa.lg.jp/kenmin/saigai/notojishin0101.html,令和6年1月1日(月曜日)に能登地方で発生した最大震度7の地震に関して、現在のところ、災害ボランティアの募集は行っておりません。市役所・社会福祉協議会等に、電話でのお問い合せを控えていただきますようお願いいたします。災害ボランティアに関する情報があった場合、当ページでお知らせいたします。
shien,mdi-hand-coin,white,orange,2024-01-04,,,,令和６年能登半島地震災害義援金｜国内災害義援金・海外救援金へのご寄付｜寄付する｜日本赤十字社,https://www.jrc.or.jp/contribute/help/20240104/,日本赤十字社では、令和６年能登半島地震災害による義援金を受け付けております。皆さま方からお寄せいただきました義援金は、被災地の方々の生活を支援するため、被災都道府県が設置する義援金配分委員会へ全額をお送りします。また、義援金の募集については、被災都道府県の判断によるものであり、日本赤十字社はその判断に基づき、受付を実施しています。
shien,mdi-hand-coin,white,orange,2023-06-16,,2024-01-04,,現在受付中の義援金 | 赤い羽根いしかわ｜社会福祉法人 石川県共同募金会,https://akaihane-ishikawa.or.jp/info/gienkin/,令和６年石川県能登地方を震源とする地震により、多数の者が生命又は身体に危害を受け、又は受けるおそれが生じていることから、10市７町で災害救助法が適用されました。石川県共同募金会では、この災害により被災された方々を支援することを目的に災害義援金の募集を行います。
shien,mdi-information,white,blue,,,2024-01-04,,令和6年能登半島地震に係る災害義援金の受付について,https://www.pref.ishikawa.lg.jp/suitou/gienkinr0601.html,令和6年1月に発生した能登地方を震源とする地震で被災された方々を支援するため、県では、日本赤十字社石川県支部及び石川県共同募金会と連携し、令和6年1月4日（木曜日）から令和6年12月27日（金曜日）の間、義援金を受け付けます。
shien,mdi-hand-coin,white,orange,2024-01-02,,,,令和6年能登半島地震への緊急支援 被災された方々に必要な支援を届ける （JVOAD） - Yahoo!ネット募金,https://donation.yahoo.co.jp/detail/5335006,石川県能登半島で震度7の地震が発生、皆さまのご支援をお願いいたします。
shien,mdi-hand-coin,white,orange,2024-01-01,,,,令和6年能登半島地震 緊急支援募金（Yahoo!基金） - Yahoo!ネット募金,https://donation.yahoo.co.jp/detail/1630064,石川県 能登地方で震度7を観測した地震被害に対する緊急支援金の受付を開始します。